"Grand Rapids-Wyoming, MI Metro Area",103088.0,3829.0,9097.0,14405.0,13713.0,11169.0,10148.0,6826.0,8316.0,20351.0,5234.0,24340
"Grants Pass, OR Metro Area",10729.0,927.0,707.0,769.0,389.0,850.0,688.0,1630.0,846.0,2924.0,999.0,24420
"Great Falls, MT Metro Area",14375.0,475.0,1459.0,2043.0,2265.0,1227.0,982.0,1433.0,1264.0,2367.0,860.0,24500
"Greeley, CO Metro Area",28301.0,1811.0,2352.0,3221.0,3658.0,3109.0,2400.0,1826.0,2411.0,5705.0,1808.0,24540
"Green Bay, WI Metro Area",39069.0,1405.0,5767.0,7178.0,4470.0,4021.0,3382.0,2191.0,2975.0,5697.0,1983.0,24580
"Greeneville, TN Micro Area",6345.0,380.0,1421.0,446.0,996.0,810.0,406.0,207.0,53.0,803.0,823.0,24620
"Greenfield Town, MA Micro Area",8822.0,89.0,1140.0,861.0,1006.0,1160.0,1042.0,756.0,589.0,1973.0,206.0,24640
"Greensboro-High Point, NC Metro Area",114513.0,3550.0,12602.0,13059.0,12928.0,11963.0,9398.0,7448.0,10069.0,24939.0,8557.0,24660
"Greenville, NC Metro Area",32296.0,766.0,2287.0,4015.0,3983.0,2281.0,2714.0,2030.0,1315.0,10603.0,2302.0,24780
"Greenville-Anderson-Mauldin, SC Metro Area",107824.0,4364.0,10051.0,15881.0,12800.0,10743.0,9688.0,3895.0,8676.0,21981.0,9745.0,24860
"Greenwood, SC Micro Area",13179.0,548.0,1180.0,1009.0,1473.0,964.0,1306.0,1082.0,1150.0,2702.0,1765.0,24940
"Gulfport-Biloxi-Pascagoula, MS Metro Area",59375.0,2296.0,4031.0,6138.0,6344.0,5954.0,3305.0,4676.0,5142.0,14640.0,6849.0,25060
"Hagerstown-Martinsburg, MD-WV Metro Area",32332.0,1201.0,3193.0,4361.0,3872.0,4941.0,2348.0,2196.0,2110.0,5361.0,2749.0,25180
"Hammond, LA Metro Area",13168.0,299.0,976.0,1031.0,1888.0,1096.0,829.0,561.0,1812.0,3379.0,1297.0,25220
"Hanford-Corcoran, CA Metro Area",20170.0,513.0,2862.0,2378.0,3261.0,1978.0,2384.0,957.0,1525.0,2691.0,1621.0,25260
"Harrisburg-Carlisle, PA Metro Area",79048.0,4466.0,8830.0,11586.0,10491.0,8716.0,6632.0,3359.0,6273.0,14873.0,3822.0,25420
"Harrisonburg, VA Metro Area",17830.0,775.0,1191.0,2824.0,1365.0,2287.0,969.0,1135.0,1169.0,5191.0,924.0,25500
"Hartford-West Hartford-East Hartford, CT Metro Area",154372.0,7222.0,11851.0,17211.0,19316.0,16433.0,11491.0,8982.0,15862.0,37301.0,8703.0,25540
"Hattiesburg, MS Metro Area",20388.0,346.0,1487.0,1443.0,3068.0,2658.0,991.0,920.0,1421.0,5210.0,2844.0,25620
"Helena, MT Micro Area",8068.0,225.0,1262.0,1366.0,1066.0,899.0,461.0,181.0,342.0,1904.0,362.0,25740
"Hermiston-Pendleton, OR Micro Area",12172.0,628.0,1978.0,1992.0,897.0,1284.0,850.0,883.0,660.0,2052.0,948.0,25840
"Hickory-Lenoir-Morganton, NC Metro Area",39904.0,2334.0,4801.0,5931.0,4400.0,3724.0,2660.0,2077.0,3959.0,6480.0,3538.0,25860
"Hilo, HI Micro Area",24169.0,2344.0,2354.0,1963.0,2690.0,1545.0,1223.0,1139.0,1342.0,6645.0,2924.0,25900
"Hilton Head Island-Bluffton-Beaufort, SC Metro Area",22113.0,309.0,1762.0,2668.0,2268.0,1883.0,1618.0,1722.0,2682.0,5052.0,2149.0,25940
"Hinesville, GA Metro Area",15881.0,175.0,1196.0,2049.0,2798.0,1230.0,2401.0,461.0,1022.0,3585.0,964.0,25980
"Guayama, PR Metro Area",7461.0,422.0,219.0,242.0,1110.0,817.0,620.0,0.0,654.0,1313.0,2064.0,25020
"Iowa City, IA Metro Area",27834.0,1078.0,2848.0,3272.0,3214.0,2674.0,2001.0,1468.0,1167.0,8532.0,1580.0,26980
"Hobbs, NM Micro Area",8246.0,688.0,1088.0,782.0,1456.0,582.0,622.0,358.0,243.0,1388.0,1039.0,26020
"Holland, MI Micro Area",7509.0,104.0,693.0,1187.0,1475.0,769.0,434.0,217.0,867.0,740.0,1023.0,26090
"Homosassa Springs, FL Metro Area",10665.0,349.0,525.0,525.0,1532.0,936.0,572.0,708.0,1004.0,3464.0,1050.0,26140
"Hot Springs, AR Metro Area",13592.0,675.0,883.0,1472.0,1890.0,2017.0,1581.0,593.0,278.0,2784.0,1419.0,26300
"Houma-Thibodaux, LA Metro Area",18511.0,886.0,2619.0,2084.0,1994.0,1594.0,1649.0,1493.0,808.0,2665.0,2719.0,26380
"Meadville, PA Micro Area",8543.0,727.0,528.0,1010.0,1346.0,762.0,377.0,472.0,620.0,1226.0,1475.0,32740
"Medford, OR Metro Area",30479.0,1045.0,2361.0,3428.0,3981.0,3639.0,2476.0,1923.0,1917.0,7734.0,1975.0,32780
"Memphis, TN-MS-AR Metro Area",199296.0,6458.0,13384.0,21727.0,18195.0,20263.0,18940.0,13670.0,19840.0,50639.0,16180.0,32820
"Merced, CA Metro Area",37311.0,1667.0,3720.0,3983.0,4562.0,3750.0,3556.0,1777.0,3448.0,8131.0,2717.0,32900
"Meridian, MS Micro Area",12935.0,261.0,921.0,1266.0,1210.0,1368.0,1432.0,559.0,387.0,4112.0,1419.0,32940
"Marion, OH Micro Area",8585.0,477.0,528.0,586.0,1100.0,838.0,755.0,626.0,565.0,1808.0,1302.0,32020
"Marquette, MI Micro Area",8220.0,234.0,559.0,1240.0,569.0,603.0,472.0,552.0,660.0,2330.0,1001.0,32100
"Marshall, TX Micro Area",6927.0,111.0,841.0,1462.0,1006.0,495.0,1036.0,0.0,303.0,555.0,1118.0,32220
"Martinsville, VA Micro Area",9082.0,539.0,530.0,891.0,1074.0,557.0,899.0,779.0,464.0,2201.0,1148.0,32300
"Mayagüez, PR Metro Area",15246.0,84.0,763.0,749.0,494.0,507.0,344.0,288.0,943.0,3201.0,7873.0,32420
"McAllen-Edinburg-Mission, TX Metro Area",74502.0,2320.0,7094.0,6433.0,6511.0,7877.0,5219.0,5356.0,6746.0,17760.0,9186.0,32580
"Miami-Fort Lauderdale-West Palm Beach, FL Metro Area",859668.0,16947.0,38548.0,70719.0,88231.0,90401.0,81628.0,62213.0,92542.0,276067.0,42372.0,33100
"Michigan City-La Porte, IN Metro Area",11691.0,409.0,807.0,1704.0,1812.0,342.0,1064.0,458.0,1551.0,2902.0,642.0,33140
"Midland, MI Metro Area",9071.0,170.0,804.0,1997.0,658.0,1341.0,858.0,660.0,587.0,1443.0,553.0,33220
"Midland, TX Metro Area",20047.0,562.0,2534.0,3096.0,2472.0,1511.0,2420.0,1091.0,983.0,3121.0,2257.0,33260
"Milwaukee-Waukesha-West Allis, WI Metro Area",251335.0,8973.0,23626.0,31943.0,30735.0,26506.0,19416.0,14512.0,22178.0,60835.0,12611.0,33340
"Minneapolis-St. Paul-Bloomington, MN-WI Metro Area",415957.0,17539.0,34935.0,56480.0,56164.0,49787.0,34005.0,29218.0,35184.0,85523.0,17122.0,33460
"Minot, ND Micro Area",12820.0,490.0,804.0,2150.0,1449.0,1583.0,1377.0,821.0,275.0,2608.0,1263.0,33500
"Missoula, MT Metro Area",21532.0,1681.0,1050.0,2042.0,3568.0,2238.0,2381.0,1321.0,1005.0,5169.0,1077.0,33540
"Mobile, AL Metro Area",63441.0,2047.0,6604.0,6429.0,6026.0,5963.0,4124.0,3779.0,5282.0,15406.0,7781.0,33660
"Modesto, CA Metro Area",71480.0,2035.0,5166.0,8256.0,7830.0,8755.0,5830.0,4438.0,5990.0,19009.0,4171.0,33700
"Monroe, LA Metro Area",24781.0,1289.0,1643.0,2437.0,3015.0,2552.0,1514.0,1503.0,3074.0,4886.0,2868.0,33740
"Monroe, MI Metro Area",12169.0,574.0,1180.0,1144.0,1093.0,1164.0,1380.0,1011.0,1245.0,2696.0,682.0,33780
"Montgomery, AL Metro Area",51071.0,1919.0,4870.0,5934.0,4708.0,4397.0,4032.0,2322.0,4363.0,12839.0,5687.0,33860
"Morehead City, NC Micro Area",7282.0,96.0,926.0,1180.0,1219.0,518.0,474.0,489.0,416.0,1285.0,679.0,33980
"Morgantown, WV Metro Area",20021.0,538.0,2042.0,1907.0,2523.0,2212.0,1059.0,708.0,663.0,6186.0,2183.0,34060
"Morristown, TN Metro Area",12530.0,486.0,1428.0,2136.0,1689.0,1018.0,413.0,634.0,1136.0,2710.0,880.0,34100
"Moses Lake, WA Micro Area",11832.0,338.0,1383.0,2400.0,1684.0,899.0,935.0,541.0,653.0,1826.0,1173.0,34180
"Mount Airy, NC Micro Area",8058.0,759.0,816.0,1360.0,464.0,1179.0,503.0,323.0,240.0,1278.0,1136.0,34340
"Mount Pleasant, MI Micro Area",9407.0,165.0,599.0,1279.0,912.0,1087.0,852.0,480.0,591.0,2846.0,596.0,34380
"Mount Vernon-Anacortes, WA Metro Area",14986.0,375.0,1383.0,1914.0,2029.0,1634.0,1916.0,712.0,1337.0,2596.0,1090.0,34580
"Muncie, IN Metro Area",15923.0,583.0,1017.0,824.0,2220.0,1493.0,649.0,1106.0,1967.0,4128.0,1936.0,34620
"Muskegon, MI Metro Area",16712.0,297.0,873.0,2262.0,1870.0,1260.0,1698.0,925.0,2089.0,3597.0,1841.0,34740
"Muskogee, OK Micro Area",8888.0,383.0,801.0,1057.0,723.0,1204.0,504.0,544.0,749.0,1667.0,1256.0,34780
"Myrtle Beach-Conway-North Myrtle Beach, SC-NC Metro Area",43783.0,954.0,3469.0,5680.0,5637.0,4032.0,3333.0,2849.0,4051.0,10504.0,3274.0,34820
"Nacogdoches, TX Micro Area",9008.0,304.0,582.0,1279.0,1159.0,1131.0,572.0,603.0,723.0,2148.0,507.0,34860
"Napa, CA Metro Area",17262.0,240.0,1250.0,1126.0,1831.0,2301.0,1194.0,1245.0,2204.0,5223.0,648.0,34900
"Naples-Immokalee-Marco Island, FL Metro Area",37736.0,1297.0,2015.0,3709.0,3934.0,3956.0,2966.0,2814.0,4930.0,10318.0,1797.0,34940
"Nashville-Davidson--Murfreesboro--Franklin, TN Metro Area",251551.0,8536.0,19426.0,32501.0,31979.0,31796.0,24710.0,16886.0,21523.0,47436.0,16758.0,34980
"New Bern, NC Metro Area",17794.0,341.0,1762.0,2040.0,1883.0,2119.0,1583.0,1291.0,1318.0,3136.0,2321.0,35100
"New Castle, PA Micro Area",10722.0,406.0,607.0,1796.0,930.0,698.0,872.0,812.0,461.0,2665.0,1475.0,35260
"New Haven-Milford, CT Metro Area",131069.0,5270.0,8928.0,13757.0,15164.0,14240.0,10072.0,7955.0,13423.0,34562.0,7698.0,35300
"New Orleans-Metairie, LA Metro Area",182013.0,4876.0,10704.0,17805.0,15656.0,16756.0,15628.0,11887.0,18542.0,53032.0,17127.0,35380
"New Philadelphia-Dover, OH Micro Area",11568.0,313.0,728.0,1845.0,1617.0,853.0,1250.0,1087.0,959.0,2194.0,722.0,35420
"New York-Newark-Jersey City, NY-NJ-PA Metro Area",3513413.0,166747.0,278852.0,395039.0,395604.0,359053.0,299177.0,217331.0,282944.0,942473.0,176193.0,35620
"Niles-Benton Harbor, MI Metro Area",17834.0,721.0,2224.0,3111.0,1828.0,1304.0,1436.0,1194.0,1093.0,3592.0,1331.0,35660
"North Port-Sarasota-Bradenton, FL Metro Area",85437.0,2499.0,5951.0,12551.0,9562.0,9110.0,6691.0,5283.0,7835.0,21316.0,4639.0,35840
"North Wilkesboro, NC Micro Area",7885.0,239.0,1071.0,940.0,566.0,451.0,549.0,664.0,766.0,1581.0,1058.0,35900
"Norwich-New London, CT Metro Area",36595.0,702.0,3542.0,4766.0,5217.0,4631.0,4311.0,1508.0,3104.0,7359.0,1455.0,35980
"Orangeburg, SC Micro Area",11295.0,390.0,532.0,538.0,1695.0,893.0,718.0,466.0,1194.0,1244.0,3625.0,36700
"Orlando-Kissimmee-Sanford, FL Metro Area",341468.0,7515.0,18199.0,38372.0,38194.0,40024.0,30878.0,25414.0,37265.0,86409.0,19198.0,36740
"Oshkosh-Neenah, WI Metro Area",23548.0,827.0,3305.0,4084.0,3130.0,2136.0,1805.0,1758.0,1792.0,3347.0,1364.0,36780
"Ottawa-Peru, IL Micro Area",17042.0,703.0,1460.0,2078.0,2662.0,1894.0,1986.0,1157.0,1052.0,2970.0,1080.0,36860
"Owensboro, KY Metro Area",14293.0,616.0,1971.0,1740.0,1622.0,1231.0,1064.0,454.0,1467.0,3231.0,897.0,36980
"Oak Harbor, WA Micro Area",9291.0,175.0,956.0,675.0,1891.0,888.0,955.0,619.0,929.0,1670.0,533.0,36020
"Ocala, FL Metro Area",35010.0,1394.0,2361.0,4074.0,3771.0,3685.0,2518.0,1726.0,2462.0,8299.0,4720.0,36100
"Ocean City, NJ Metro Area",7677.0,156.0,298.0,259.0,963.0,534.0,476.0,814.0,896.0,2335.0,946.0,36140
"Odessa, TX Metro Area",19177.0,678.0,2303.0,2710.0,2533.0,2622.0,2045.0,511.0,1396.0,2542.0,1837.0,36220
"Ogden-Clearfield, UT Metro Area",50897.0,2123.0,5131.0,8844.0,7455.0,5545.0,3698.0,2779.0,3758.0,9068.0,2496.0,36260
"Ogdensburg-Massena, NY Micro Area",11839.0,986.0,858.0,1923.0,1329.0,1498.0,255.0,578.0,689.0,2746.0,977.0,36300
"Oklahoma City, OK Metro Area",192848.0,6829.0,18551.0,28961.0,26171.0,18678.0,12858.0,13227.0,13942.0,38993.0,14638.0,36420
"Olean, NY Micro Area",9153.0,544.0,1141.0,1046.0,978.0,1420.0,528.0,576.0,529.0,1662.0,729.0,36460
"Olympia-Tumwater, WA Metro Area",39779.0,1944.0,3086.0,4838.0,4595.0,4564.0,4419.0,2846.0,2996.0,9106.0,1385.0,36500
"Omaha-Council Bluffs, NE-IA Metro Area",127305.0,4728.0,12252.0,19170.0,17014.0,14030.0,9362.0,7883.0,9977.0,25704.0,7185.0,36540
"Opelousas, LA Micro Area",10337.0,637.0,182.0,978.0,1020.0,670.0,674.0,971.0,1081.0,2091.0,2033.0,36660
"Owosso, MI Micro Area",7720.0,243.0,691.0,1637.0,1002.0,748.0,373.0,814.0,568.0,1116.0,528.0,37020
"Oxnard-Thousand Oaks-Ventura, CA Metro Area",102016.0,2039.0,6221.0,8410.0,11452.0,11328.0,8645.0,7850.0,10791.0,29462.0,5818.0,37100
"Paducah, KY-IL Micro Area",12645.0,740.0,1029.0,1418.0,1892.0,786.0,1317.0,1075.0,799.0,2328.0,1261.0,37140
"Palatka, FL Micro Area",6296.0,225.0,461.0,927.0,736.0,813.0,92.0,320.0,413.0,1430.0,879.0,37260
"Palm Bay-Melbourne-Titusville, FL Metro Area",55114.0,1866.0,2730.0,4951.0,6031.0,6498.0,5407.0,4933.0,5391.0,14123.0,3184.0,37340
"Panama City, FL Metro Area",25141.0,364.0,2195.0,2815.0,3101.0,4037.0,2408.0,1754.0,1831.0,5269.0,1367.0,37460
"Parkersburg-Vienna, WV Metro Area",10502.0,107.0,646.0,1246.0,959.0,1178.0,787.0,927.0,1205.0,1991.0,1456.0,37620
"Pensacola-Ferry Pass-Brent, FL Metro Area",58406.0,2216.0,4296.0,6793.0,9004.0,6258.0,5175.0,4220.0,6096.0,10361.0,3987.0,37860
"Peoria, IL Metro Area",45071.0,2247.0,4669.0,5809.0,5478.0,4930.0,2295.0,2559.0,3153.0,9475.0,4456.0,37900
"Philadelphia-Camden-Wilmington, PA-NJ-DE-MD Metro Area",764467.0,27797.0,62674.0,94239.0,88526.0,78025.0,63140.0,42251.0,57750.0,202480.0,47585.0,37980
"Portland-South Portland, ME Metro Area",67663.0,1669.0,5911.0,8657.0,8250.0,8346.0,7134.0,4464.0,4842.0,14559.0,3831.0,38860
"Portland-Vancouver-Hillsboro, OR-WA Metro Area",359090.0,9287.0,25450.0,44731.0,48357.0,49400.0,29026.0,23060.0,34677.0,79268.0,15834.0,38900
"Port St. Lucie, FL Metro Area",44035.0,861.0,986.0,4612.0,4453.0,4960.0,5675.0,3160.0,5037.0,11563.0,2728.0,38940
"Phoenix-Mesa-Scottsdale, AZ Metro Area",624706.0,21042.0,49733.0,82817.0,86701.0,73654.0,56178.0,37023.0,54338.0,129582.0,33638.0,38060
"Pine Bluff, AR Metro Area",12014.0,553.0,1601.0,1465.0,744.0,761.0,1029.0,796.0,1263.0,2024.0,1778.0,38220
"Pinehurst-Southern Pines, NC Micro Area",9526.0,983.0,1378.0,1355.0,1118.0,1327.0,383.0,323.0,534.0,1087.0,1038.0,38240
"Pittsburgh, PA Metro Area",308230.0,14058.0,34326.0,40796.0,32780.0,34359.0,25798.0,18536.0,20838.0,62678.0,24061.0,38300
"Pittsfield, MA Metro Area",17573.0,697.0,2010.0,1816.0,1662.0,1631.0,1959.0,1293.0,920.0,4858.0,727.0,38340
"Plattsburgh, NY Micro Area",9920.0,625.0,1007.0,1391.0,1286.0,638.0,962.0,507.0,474.0,2069.0,961.0,38460
"Pocatello, ID Metro Area",10639.0,988.0,968.0,1521.0,1936.0,754.0,381.0,631.0,688.0,2103.0,669.0,38540
"Ponce, PR Metro Area",32903.0,514.0,1720.0,2385.0,2469.0,1894.0,1806.0,789.0,2072.0,5623.0,13631.0,38660
"Port Angeles, WA Micro Area",9225.0,400.0,815.0,1948.0,406.0,680.0,500.0,472.0,1070.0,2176.0,758.0,38820
"Portsmouth, OH Micro Area",9682.0,481.0,1484.0,746.0,645.0,1373.0,894.0,574.0,513.0,1803.0,1169.0,39020
"Pottsville, PA Micro Area",14215.0,633.0,1550.0,1247.0,1098.0,1294.0,1865.0,455.0,766.0,3272.0,2035.0,39060
"Prescott, AZ Metro Area",26935.0,697.0,2631.0,3439.0,3113.0,1708.0,1476.0,2183.0,3992.0,5301.0,2395.0,39140
"Providence-Warwick, RI-MA Metro Area",239105.0,11821.0,21259.0,32417.0,25949.0,28212.0,21753.0,16237.0,18481.0,48937.0,14039.0,39300
"Provo-Orem, UT Metro Area",52802.0,1016.0,4983.0,8179.0,6729.0,6139.0,5630.0,4026.0,3923.0,10127.0,2050.0,39340
"Pueblo, CO Metro Area",22544.0,988.0,1251.0,2416.0,2456.0,2098.0,2356.0,999.0,2172.0,6168.0,1640.0,39380
"Punta Gorda, FL Metro Area",12467.0,144.0,736.0,1244.0,1326.0,897.0,900.0,672.0,1336.0,4658.0,554.0,39460
"Quincy, IL-MO Micro Area",8421.0,297.0,1340.0,505.0,1253.0,853.0,769.0,178.0,616.0,1432.0,1178.0,39500
"Racine, WI Metro Area",25822.0,920.0,2048.0,2492.0,2407.0,3588.0,2954.0,1885.0,2767.0,6012.0,749.0,39540
"Raleigh, NC Metro Area",176354.0,6849.0,17577.0,26309.0,26083.0,19395.0,15796.0,10695.0,16319.0,29050.0,8281.0,39580
"Rapid City, SD Metro Area",17438.0,303.0,1566.0,2234.0,2346.0,2400.0,1713.0,2384.0,1504.0,2174.0,814.0,39660
"Reading, PA Metro Area",44987.0,1556.0,3899.0,5203.0,5070.0,4198.0,4788.0,3221.0,4349.0,9675.0,3028.0,39740
"Redding, CA Metro Area",23796.0,761.0,1744.0,3545.0,2605.0,2006.0,1976.0,737.0,1920.0,6893.0,1609.0,39820
"Reno, NV Metro Area",78428.0,3308.0,6581.0,10726.0,10906.0,9346.0,5799.0,5330.0,8429.0,14849.0,3154.0,39900
"Richmond, IN Micro Area",9957.0,384.0,1091.0,1756.0,1233.0,1274.0,1064.0,778.0,861.0,742.0,774.0,39980
"Richmond, VA Metro Area",171199.0,6757.0,12181.0,22355.0,22203.0,19005.0,15428.0,12661.0,14309.0,36948.0,9352.0,40060
"Richmond-Berea, KY Micro Area",15212.0,1321.0,1943.0,1560.0,1953.0,1751.0,969.0,804.0,963.0,2692.0,1256.0,40080
"Riverside-San Bernardino-Ontario, CA Metro Area",483970.0,13474.0,27440.0,46036.0,50249.0,51050.0,43118.0,37641.0,51538.0,140822.0,22602.0,40140
"Roanoke, VA Metro Area",41165.0,1973.0,4820.0,5167.0,3653.0,4386.0,3527.0,1712.0,4039.0,9768.0,2120.0,40220
"Roanoke Rapids, NC Micro Area",9956.0,218.0,541.0,1227.0,767.0,735.0,1390.0,761.0,388.0,2236.0,1693.0,40260
"Rochester, MN Metro Area",23806.0,1172.0,1763.0,3270.0,3144.0,3062.0,1405.0,1948.0,1427.0,5050.0,1565.0,40340
"Rochester, NY Metro Area",136951.0,4971.0,10156.0,15798.0,15309.0,15717.0,12785.0,7504.0,10181.0,38931.0,5599.0,40380
"Rockford, IL Metro Area",41426.0,1575.0,3421.0,5261.0,5843.0,4554.0,3635.0,2714.0,2837.0,9055.0,2531.0,40420
"Rocky Mount, NC Metro Area",20011.0,951.0,1720.0,2290.0,2281.0,2099.0,1660.0,1274.0,751.0,4394.0,2591.0,40580
"Rome, GA Metro Area",13797.0,309.0,1658.0,1397.0,823.0,1206.0,1541.0,1758.0,1432.0,2382.0,1291.0,40660
"Roseburg, OR Micro Area",13634.0,840.0,1355.0,2015.0,2390.0,1304.0,651.0,1010.0,1032.0,2170.0,867.0,40700
"Roswell, NM Micro Area",8296.0,69.0,881.0,1132.0,980.0,859.0,1030.0,305.0,635.0,1295.0,1110.0,40740
"Russellville, AR Micro Area",8325.0,321.0,1245.0,954.0,927.0,424.0,697.0,895.0,332.0,1491.0,1039.0,40780
"Sacramento--Roseville--Arden-Arcade, CA Metro Area",328335.0,7027.0,22108.0,34304.0,39821.0,37901.0,27005.0,22879.0,31599.0,88638.0,17053.0,40900
"Saginaw, MI Metro Area",23216.0,1335.0,1795.0,1749.0,2426.0,2865.0,2108.0,1764.0,1952.0,5517.0,1705.0,40980
"Salisbury, MD-DE Metro Area",41901.0,1428.0,3961.0,4167.0,4757.0,3130.0,4336.0,2872.0,4315.0,9198.0,3737.0,41540
"Salt Lake City, UT Metro Area",130931.0,5156.0,10775.0,19189.0,17219.0,16316.0,11070.0,8034.0,11480.0,25400.0,6292.0,41620
"San Angelo, TX Metro Area",16460.0,721.0,2229.0,2330.0,2766.0,736.0,790.0,1265.0,1277.0,3519.0,827.0,41660
"San Antonio-New Braunfels, TX Metro Area",310532.0,7142.0,21232.0,36898.0,35976.0,37521.0,27080.0,18835.0,26661.0,68691.0,30496.0,41700
"San Diego-Carlsbad, CA Metro Area",530366.0,10335.0,30549.0,52828.0,61553.0,59812.0,49084.0,37046.0,57521.0,151485.0,20153.0,41740
"Sandusky, OH Micro Area",9238.0,430.0,708.0,1482.0,1640.0,629.0,1043.0,336.0,97.0,2752.0,121.0,41780
"San Francisco-Oakland-Hayward, CA Metro Area",765074.0,42684.0,75302.0,96130.0,99668.0,85383.0,59152.0,41475.0,64905.0,168242.0,32133.0,41860
"San Germán, PR Metro Area",12184.0,42.0,493.0,484.0,502.0,761.0,231.0,428.0,940.0,1176.0,7127.0,41900
"San Jose-Sunnyvale-Santa Clara, CA Metro Area",294146.0,14010.0,27897.0,39205.0,41370.0,29889.0,27487.0,17444.0,23364.0,62166.0,11314.0,41940
"San Juan-Carolina-Caguas, PR Metro Area",245385.0,4245.0,12249.0,14324.0,14693.0,14899.0,12129.0,9617.0,12532.0,42550.0,108147.0,41980
"St. Cloud, MN Metro Area",24273.0,1059.0,3028.0,3570.0,2814.0,1926.0,1717.0,1661.0,2404.0,4868.0,1226.0,41060
"St. George, UT Metro Area",17183.0,277.0,1361.0,1998.0,2602.0,2028.0,1497.0,1428.0,1738.0,2414.0,1840.0,41100
"St. Joseph, MO-KS Metro Area",15418.0,678.0,2206.0,1579.0,1641.0,1450.0,1143.0,518.0,1016.0,3227.0,1960.0,41140
"St. Louis, MO-IL Metro Area",359888.0,11383.0,36837.0,49333.0,44646.0,38228.0,27295.0,18259.0,31217.0,79115.0,23575.0,41180
"Salem, OH Micro Area",11422.0,777.0,631.0,1683.0,1011.0,823.0,1409.0,880.0,603.0,2364.0,1241.0,41400
"Salem, OR Metro Area",60751.0,1756.0,6847.0,5992.0,6499.0,6146.0,5024.0,4640.0,6263.0,15553.0,2031.0,41420
"Salinas, CA Metro Area",61503.0,1583.0,4046.0,7656.0,6554.0,6537.0,6567.0,4536.0,5779.0,15319.0,2926.0,41500
"San Luis Obispo-Paso Robles-Arroyo Grande, CA Metro Area",41118.0,789.0,2913.0,2857.0,4244.0,4365.0,4793.0,3320.0,4154.0,9908.0,3775.0,42020
"Santa Cruz-Watsonville, CA Metro Area",37907.0,1063.0,2267.0,2588.0,4139.0,4380.0,2700.0,3483.0,4762.0,10352.0,2173.0,42100
"Santa Fe, NM Metro Area",18075.0,1256.0,2001.0,2081.0,2029.0,876.0,1771.0,817.0,1348.0,4392.0,1504.0,42140
"Santa Maria-Santa Barbara, CA Metro Area",69620.0,1764.0,3818.0,7359.0,7380.0,6985.0,5984.0,5064.0,8242.0,19646.0,3378.0,42200
"Santa Rosa, CA Metro Area",72190.0,1884.0,4319.0,8752.0,7823.0,9128.0,5593.0,5893.0,5999.0,19798.0,3001.0,42220
"Savannah, GA Metro Area",56498.0,809.0,3585.0,7684.0,6466.0,6169.0,5352.0,3919.0,4640.0,13287.0,4587.0,42340
"Scranton--Wilkes-Barre--Hazleton, PA Metro Area",74083.0,3441.0,8754.0,9684.0,8137.0,6632.0,4643.0,4847.0,4654.0,16197.0,7094.0,42540
"Searcy, AR Micro Area",10561.0,191.0,277.0,1040.0,1991.0,1172.0,608.0,626.0,760.0,1770.0,2126.0,42620
"Seattle-Tacoma-Bellevue, WA Metro Area",614200.0,17194.0,48006.0,84707.0,84565.0,76869.0,56167.0,39848.0,52256.0,131476.0,23112.0,42660
"Sebastian-Vero Beach, FL Metro Area",10101.0,130.0,746.0,738.0,480.0,1966.0,393.0,611.0,790.0,3029.0,1218.0,42680
"Sebring, FL Metro Area",8675.0,60.0,547.0,1159.0,632.0,836.0,722.0,953.0,801.0,1624.0,1341.0,42700
"Seneca, SC Micro Area",8419.0,384.0,558.0,975.0,1214.0,615.0,704.0,746.0,221.0,1899.0,1103.0,42860
"Sevierville, TN Micro Area",11469.0,514.0,871.0,1739.0,1326.0,1049.0,1288.0,1000.0,356.0,2520.0,806.0,42940
"Shawnee, OK Micro Area",8467.0,293.0,1092.0,974.0,1243.0,667.0,622.0,616.0,338.0,1716.0,906.0,43060
"Sheboygan, WI Metro Area",13106.0,531.0,2340.0,2443.0,1711.0,1099.0,912.0,448.0,1148.0,2077.0,397.0,43100
"Shelby, NC Micro Area",11269.0,700.0,1100.0,798.0,943.0,1202.0,1304.0,623.0,608.0,2221.0,1770.0,43140
"Shelton, WA Micro Area",6977.0,525.0,702.0,377.0,696.0,288.0,292.0,188.0,217.0,2110.0,1582.0,43220
"Sherman-Denison, TX Metro Area",16167.0,476.0,791.0,1652.0,2137.0,2092.0,1312.0,483.0,1269.0,4543.0,1412.0,43300
"Show Low, AZ Micro Area",10030.0,896.0,1504.0,847.0,1108.0,619.0,1148.0,205.0,770.0,1163.0,1770.0,43320
"Shreveport-Bossier City, LA Metro Area",65989.0,2122.0,5655.0,5656.0,5339.0,5135.0,5117.0,4873.0,6216.0,18560.0,7316.0,43340
"Sierra Vista-Douglas, AZ Metro Area",14049.0,949.0,872.0,1870.0,1754.0,1345.0,1329.0,989.0,1024.0,2766.0,1151.0,43420
"Sioux City, IA-NE-SD Metro Area",20997.0,1890.0,3108.0,2713.0,1668.0,3229.0,1208.0,1306.0,1417.0,3295.0,1163.0,43580
"Sioux Falls, SD Metro Area",33829.0,947.0,3278.0,4418.0,4797.0,3738.0,3389.0,2271.0,2494.0,6678.0,1819.0,43620
"Somerset, PA Micro Area",5992.0,458.0,382.0,1192.0,392.0,591.0,481.0,409.0,266.0,630.0,1191.0,43740
"South Bend-Mishawaka, IN-MI Metro Area",38750.0,3108.0,3603.0,4076.0,5768.0,3914.0,3332.0,2348.0,2915.0,7035.0,2651.0,43780
"Spartanburg, SC Metro Area",37318.0,1407.0,4545.0,4377.0,4690.0,4576.0,3016.0,1691.0,2122.0,6596.0,4298.0,43900
"Springfield, IL Metro Area",27712.0,1151.0,3462.0,3398.0,2042.0,2664.0,1891.0,1539.0,1804.0,7613.0,2148.0,44100
"Springfield, MA Metro Area",91567.0,3751.0,7602.0,10052.0,9117.0,10535.0,8904.0,5703.0,6699.0,22990.0,6214.0,44140
"Springfield, MO Metro Area",73200.0,2537.0,6576.0,10584.0,7139.0,7282.0,6093.0,5189.0,4652.0,17969.0,5179.0,44180
"Springfield, OH Metro Area",19269.0,1476.0,2310.0,3517.0,3501.0,1707.0,1141.0,986.0,690.0,2562.0,1379.0,44220
"State College, PA Metro Area",21542.0,1054.0,1505.0,2131.0,1679.0,1448.0,1148.0,916.0,2051.0,7066.0,2544.0,44300
"Statesboro, GA Micro Area",13655.0,895.0,551.0,1208.0,1425.0,1247.0,1310.0,1118.0,533.0,3413.0,1955.0,44340
"Staunton-Waynesboro, VA Metro Area",15916.0,1088.0,1461.0,1920.0,1148.0,2247.0,1114.0,842.0,1295.0,3598.0,1203.0,44420
"Stevens Point, WI Micro Area",9071.0,456.0,577.0,1490.0,1085.0,819.0,803.0,954.0,317.0,2043.0,527.0,44620
"Stillwater, OK Micro Area",13953.0,340.0,1891.0,880.0,1686.0,1217.0,579.0,656.0,1455.0,3358.0,1891.0,44660
"Stockton-Lodi, CA Metro Area",105439.0,1830.0,7853.0,12469.0,14217.0,9656.0,11130.0,6798.0,10161.0,26087.0,5238.0,44700
"Sumter, SC Metro Area",15206.0,1390.0,1475.0,1585.0,1234.0,1601.0,1484.0,1224.0,1092.0,2468.0,1653.0,44940
"Sunbury, PA Micro Area",11628.0,424.0,1021.0,779.0,1321.0,1827.0,836.0,563.0,824.0,2403.0,1630.0,44980
"Spokane-Spokane Valley, WA Metro Area",80536.0,2938.0,7285.0,9989.0,9575.0,8665.0,8312.0,4570.0,6242.0,18994.0,3966.0,44060
"Syracuse, NY Metro Area",82115.0,2873.0,8731.0,9500.0,9891.0,10025.0,5092.0,3980.0,5303.0,20991.0,5729.0,45060
"Talladega-Sylacauga, AL Micro Area",10418.0,600.0,842.0,605.0,693.0,893.0,920.0,654.0,654.0,3010.0,1547.0,45180
"Tallahassee, FL Metro Area",59846.0,1750.0,5232.0,6018.0,5311.0,5734.0,4545.0,2971.0,5265.0,16439.0,6581.0,45220
"Tampa-St. Petersburg-Clearwater, FL Metro Area",432831.0,10269.0,27544.0,43729.0,56923.0,53132.0,39336.0,29563.0,42400.0,105062.0,24873.0,45300
"Terre Haute, IN Metro Area",22917.0,673.0,2343.0,2586.0,2513.0,1917.0,1967.0,1704.0,2657.0,4524.0,2033.0,45460
"Texarkana, TX-AR Metro Area",20702.0,1417.0,2219.0,1323.0,1607.0,2020.0,737.0,1157.0,2307.0,4996.0,2919.0,45500
"The Villages, FL Metro Area",7883.0,324.0,617.0,745.0,850.0,652.0,73.0,824.0,565.0,1261.0,1972.0,45540
"Toledo, OH Metro Area",92477.0,5195.0,9505.0,10281.0,12453.0,11754.0,6039.0,4589.0,6743.0,19138.0,6780.0,45780
"Topeka, KS Metro Area",30434.0,942.0,2404.0,3921.0,3399.0,3984.0,1858.0,1169.0,2865.0,8003.0,1889.0,45820
"Torrington, CT Micro Area",16410.0,808.0,985.0,1978.0,1666.0,1530.0,1733.0,1287.0,2058.0,3111.0,1254.0,45860
"Traverse City, MI Micro Area",12027.0,272.0,1766.0,757.0,1462.0,1759.0,862.0,485.0,798.0,2996.0,870.0,45900
"Trenton, NJ Metro Area",49761.0,1671.0,3567.0,4568.0,7291.0,6206.0,3368.0,4033.0,4173.0,12453.0,2431.0,45940
"Twin Falls, ID Metro Area",12524.0,257.0,1230.0,1285.0,1648.0,726.0,787.0,1865.0,549.0,2275.0,1902.0,46300
"Truckee-Grass Valley, CA Micro Area",10736.0,316.0,1072.0,1146.0,744.0,1093.0,1373.0,205.0,636.0,3372.0,779.0,46020
"Tucson, AZ Metro Area",151689.0,5524.0,11905.0,18624.0,17540.0,19651.0,13537.0,8519.0,12238.0,33320.0,10831.0,46060
"Tullahoma-Manchester, TN Micro Area",11844.0,501.0,1425.0,1169.0,1161.0,1519.0,1066.0,772.0,677.0,2055.0,1499.0,46100
"Tulsa, OK Metro Area",133682.0,6709.0,14188.0,17741.0,17867.0,12196.0,11188.0,7734.0,10937.0,25121.0,10001.0,46140
"Tupelo, MS Micro Area",14840.0,836.0,458.0,3708.0,1544.0,967.0,462.0,1209.0,1278.0,2380.0,1998.0,46180
"Tuscaloosa, AL Metro Area",31315.0,825.0,3267.0,3582.0,3402.0,3463.0,2328.0,1013.0,2372.0,7996.0,3067.0,46220
"Tyler, TX Metro Area",25458.0,1418.0,4190.0,3085.0,3125.0,1882.0,1706.0,1590.0,1768.0,5075.0,1619.0,46340
"Ukiah, CA Micro Area",14142.0,329.0,831.0,1247.0,1654.0,1492.0,1477.0,1365.0,1129.0,2891.0,1727.0,46380
