NAME,B25070_001E,B25070_002E,B25070_003E,B25070_004E,B25070_005E,B25070_006E,B25070_007E,B25070_008E,B25070_009E,B25070_010E,B25070_011E,metropolitan statistical area/micropolitan statistical area
"Aberdeen, WA Micro Area",7681.0,205.0,1523.0,725.0,615.0,1116.0,431.0,610.0,543.0,1512.0,401.0,10140
"Abilene, TX Metro Area",25067.0,522.0,1670.0,4174.0,2302.0,1957.0,1673.0,2712.0,3262.0,4861.0,1934.0,10180
"Adrian, MI Micro Area",7902.0,345.0,754.0,1255.0,432.0,451.0,1492.0,108.0,646.0,1443.0,976.0,10300
"Aguadilla, PR Metro Area",30177.0,657.0,1648.0,1811.0,2330.0,815.0,1343.0,1193.0,588.0,2924.0,16868.0,10380
"Akron, OH Metro Area",94990.0,3336.0,9661.0,11159.0,10435.0,9377.0,8051.0,6217.0,7753.0,23846.0,5155.0,10420
"Alamogordo, NM Micro Area",7517.0,246.0,761.0,435.0,1227.0,701.0,614.0,588.0,416.0,1413.0,1116.0,10460
"Albany, GA Metro Area",27734.0,1709.0,2242.0,3891.0,3644.0,3378.0,761.0,1482.0,1659.0,6064.0,2904.0,10500
"Albany, OR Metro Area",17097.0,309.0,1436.0,1617.0,2616.0,1531.0,1954.0,749.0,1252.0,5039.0,594.0,10540
"Albany-Schenectady-Troy, NY Metro Area",139464.0,6100.0,12206.0,17703.0,17753.0,15071.0,14136.0,5975.0,10129.0,32114.0,8277.0,10580
"Albemarle, NC Micro Area",5857.0,503.0,458.0,1444.0,231.0,529.0,201.0,245.0,711.0,691.0,844.0,10620
"Albertville, AL Micro Area",9088.0,260.0,1038.0,714.0,1067.0,1473.0,1015.0,474.0,640.0,1128.0,1279.0,10700
"Albuquerque, NM Metro Area",121091.0,4761.0,7589.0,16812.0,13554.0,13656.0,10270.0,7148.0,9773.0,29315.0,8213.0,10740
"Alexandria, LA Metro Area",21771.0,561.0,2011.0,2333.0,2362.0,2128.0,1931.0,1004.0,1554.0,4930.0,2957.0,10780
"Allentown-Bethlehem-Easton, PA-NJ Metro Area",104731.0,3116.0,8679.0,10862.0,11563.0,11075.0,9825.0,8335.0,8818.0,25998.0,6460.0,10900
"Altoona, PA Metro Area",14355.0,499.0,1502.0,1389.0,1182.0,2140.0,1338.0,890.0,1249.0,2382.0,1784.0,11020
"Amarillo, TX Metro Area",35902.0,1580.0,2031.0,3018.0,5250.0,5775.0,1975.0,2165.0,5335.0,5935.0,2838.0,11100
"Ames, IA Metro Area",18954.0,750.0,2106.0,2044.0,2260.0,2230.0,2713.0,1092.0,785.0,4533.0,441.0,11180
"Amherst Town-Northampton, MA Metro Area",21354.0,166.0,1657.0,2100.0,2837.0,2809.0,1488.0,906.0,1476.0,5822.0,2093.0,11200
"Anchorage, AK Metro Area",49243.0,1924.0,4056.0,4516.0,6706.0,7143.0,4959.0,3502.0,3931.0,9456.0,3050.0,11260
"Anderson Creek, NC Micro Area",11765.0,348.0,670.0,1063.0,1253.0,562.0,2248.0,1636.0,578.0,2256.0,1151.0,11360
"Ann Arbor, MI Metro Area",55892.0,1551.0,3158.0,5978.0,6002.0,6447.0,4519.0,2363.0,5235.0,17660.0,2979.0,11460
"Anniston-Oxford, AL Metro Area",14476.0,1186.0,771.0,1665.0,1397.0,1554.0,957.0,629.0,1141.0,3002.0,2174.0,11500
"Appleton, WI Metro Area",26848.0,930.0,2643.0,4837.0,4668.0,3047.0,2880.0,1074.0,2252.0,3459.0,1058.0,11540
"Arecibo, PR Metro Area",18683.0,556.0,990.0,606.0,1026.0,1738.0,814.0,662.0,676.0,2239.0,9376.0,11640
"Asheville, NC Metro Area",50325.0,1185.0,3246.0,5976.0,5455.0,6247.0,6510.0,2840.0,4828.0,9553.0,4485.0,11700
"Athens, TN Micro Area",5399.0,352.0,761.0,365.0,575.0,371.0,452.0,188.0,355.0,976.0,1004.0,11940
"Athens, TX Micro Area",7327.0,216.0,902.0,622.0,767.0,611.0,678.0,848.0,169.0,1340.0,1174.0,11980
"Athens-Clarke County, GA Metro Area",38552.0,793.0,2067.0,3842.0,4578.0,3913.0,2608.0,2901.0,3679.0,10146.0,4025.0,12020
"Atlanta-Sandy Springs-Roswell, GA Metro Area",770945.0,21003.0,49743.0,75242.0,89727.0,81012.0,71338.0,50769.0,71975.0,222452.0,37684.0,12060
"Atlantic City-Hammonton, NJ Metro Area",44363.0,1462.0,3946.0,4817.0,4566.0,5725.0,4355.0,1221.0,2830.0,11911.0,3530.0,12100
"Auburn, NY Micro Area",7007.0,347.0,863.0,923.0,982.0,978.0,868.0,231.0,392.0,926.0,497.0,12180
"Auburn-Opelika, AL Metro Area",29381.0,605.0,2385.0,1893.0,3067.0,3219.0,2274.0,1558.0,1669.0,9318.0,3393.0,12220
"Augusta-Richmond County, GA-SC Metro Area",69598.0,3068.0,4189.0,6725.0,6681.0,5460.0,5935.0,2570.0,8470.0,18850.0,7650.0,12260
"Augusta-Waterville, ME Micro Area",15232.0,687.0,1511.0,1097.0,1971.0,1890.0,2064.0,1310.0,657.0,2823.0,1222.0,12300
"Austin-Round Rock-San Marcos, TX Metro Area",433882.0,13440.0,29605.0,49366.0,56499.0,48003.0,42110.0,31612.0,44189.0,101072.0,17986.0,12420
"Bakersfield-Delano, CA Metro Area",116648.0,3589.0,6525.0,12684.0,13954.0,11768.0,9178.0,7764.0,10945.0,31703.0,8538.0,12540
"Baltimore-Columbia-Towson, MD Metro Area",371580.0,14393.0,24827.0,38382.0,41651.0,42875.0,29797.0,26790.0,33645.0,98792.0,20428.0,12580
"Bangor, ME Metro Area",18959.0,387.0,1645.0,2226.0,1703.0,2894.0,2043.0,888.0,1640.0,3445.0,2088.0,12620
"Baraboo, WI Micro Area",8263.0,253.0,1408.0,1035.0,1306.0,1317.0,194.0,406.0,447.0,1088.0,809.0,12660
"Barnstable Town, MA Metro Area",23553.0,935.0,1837.0,1286.0,1726.0,1944.0,1376.0,2069.0,2483.0,6670.0,3227.0,12700
"Baton Rouge, LA Metro Area",102522.0,3026.0,7557.0,7813.0,8333.0,8841.0,7421.0,5179.0,10926.0,30310.0,13116.0,12940
"Battle Creek, MI Metro Area",15064.0,545.0,728.0,1561.0,2481.0,1403.0,1368.0,328.0,1865.0,3530.0,1255.0,12980
"Bay City, MI Metro Area",9920.0,473.0,571.0,1465.0,864.0,1609.0,917.0,137.0,899.0,2277.0,708.0,13020
"Beaumont-Port Arthur, TX Metro Area",47647.0,2412.0,4228.0,4462.0,5332.0,4181.0,3413.0,2096.0,5335.0,12290.0,3898.0,13140
"Beaver Dam, WI Micro Area",10139.0,301.0,1864.0,1655.0,1381.0,649.0,1091.0,522.0,691.0,1333.0,652.0,13180
"Beckley, WV Metro Area",11490.0,421.0,1173.0,1053.0,897.0,1092.0,878.0,895.0,134.0,2953.0,1994.0,13220
"Bellingham, WA Metro Area",34542.0,1074.0,1641.0,2328.0,3357.0,3723.0,3694.0,2644.0,3957.0,10274.0,1850.0,13380
"Bend, OR Metro Area",30427.0,1270.0,1993.0,3570.0,3706.0,4325.0,2478.0,1416.0,2225.0,7185.0,2259.0,13460
"Billings, MT Metro Area",26164.0,936.0,2040.0,3200.0,3741.0,3887.0,1653.0,1903.0,2976.0,4156.0,1672.0,13740
"Binghamton, NY Metro Area",31537.0,1862.0,2873.0,3257.0,3157.0,3605.0,2146.0,1421.0,1918.0,8674.0,2624.0,13780
"Birmingham, AL Metro Area",136940.0,4350.0,10429.0,14890.0,14042.0,15133.0,9798.0,9241.0,9876.0,35238.0,13943.0,13820
"Bismarck, ND Metro Area",15303.0,1211.0,1698.0,1979.0,1585.0,1038.0,991.0,897.0,1572.0,2722.0,1610.0,13900
"Blacksburg-Christiansburg-Radford, VA Metro Area",25760.0,1307.0,2802.0,2523.0,2539.0,2605.0,1235.0,1240.0,1607.0,5811.0,4091.0,13980
"Bloomington, IL Metro Area",24538.0,903.0,2741.0,3259.0,3138.0,2490.0,1241.0,923.0,2110.0,6055.0,1678.0,14010
"Bloomington, IN Metro Area",31450.0,1118.0,1247.0,3301.0,3115.0,2894.0,2546.0,1799.0,2844.0,9518.0,3068.0,14020
"Bloomsburg-Berwick, PA Micro Area",7186.0,260.0,1029.0,544.0,595.0,771.0,820.0,504.0,318.0,1352.0,993.0,14100
"Bluefield, WV-VA Micro Area",11775.0,610.0,486.0,1337.0,918.0,1391.0,1167.0,910.0,165.0,2614.0,2177.0,14140
"Boise City, ID Metro Area",87514.0,1941.0,5126.0,10756.0,12221.0,9413.0,9507.0,6334.0,8484.0,18036.0,5696.0,14260
"Boston-Cambridge-Newton, MA-NH Metro Area",749745.0,29887.0,47715.0,77939.0,94730.0,86608.0,66098.0,48880.0,64116.0,197171.0,36601.0,14460
"Boulder, CO Metro Area",53256.0,1142.0,3577.0,5280.0,5007.0,4911.0,4763.0,2817.0,4898.0,18931.0,1930.0,14500
"Bowling Green, KY Metro Area",29314.0,1019.0,2260.0,3409.0,3329.0,4289.0,2803.0,1766.0,1998.0,7002.0,1439.0,14540
"Bozeman, MT Metro Area",21649.0,614.0,717.0,2602.0,2195.0,2971.0,2764.0,1970.0,784.0,5381.0,1651.0,14580
"Brainerd, MN Micro Area",9270.0,349.0,1224.0,939.0,842.0,1042.0,923.0,430.0,884.0,1302.0,1335.0,14660
"Bremerton-Silverdale-Port Orchard, WA Metro Area",31962.0,252.0,2116.0,2707.0,4289.0,3077.0,2266.0,2907.0,3196.0,8718.0,2434.0,14740
"Bridgeport-Stamford-Danbury, CT Metro Area",124856.0,4465.0,8135.0,13375.0,14783.0,13696.0,9334.0,8653.0,12286.0,34885.0,5244.0,14860
"Brigham City, UT-ID Micro Area",5015.0,342.0,328.0,458.0,568.0,571.0,202.0,384.0,274.0,1328.0,560.0,14940
"Brownsville-Harlingen, TX Metro Area",48372.0,1611.0,3176.0,6225.0,6349.0,3847.0,3937.0,3403.0,3864.0,9606.0,6354.0,15180
"Brunswick-St. Simons, GA Metro Area",15108.0,867.0,1193.0,1497.0,2612.0,882.0,552.0,743.0,586.0,4154.0,2022.0,15260
"Buffalo-Cheektowaga, NY Metro Area",170248.0,7547.0,16936.0,19555.0,19755.0,17988.0,14760.0,9094.0,9665.0,44497.0,10451.0,15380
"Burlington, NC Metro Area",24089.0,1244.0,2974.0,2652.0,2659.0,2657.0,2455.0,1147.0,1771.0,4416.0,2114.0,15500
"Burlington-South Burlington, VT Metro Area",29366.0,1299.0,1812.0,3704.0,3495.0,4259.0,1913.0,1958.0,2618.0,6825.0,1483.0,15540
"Canton-Massillon, OH Metro Area",49695.0,2808.0,5571.0,7209.0,6801.0,6299.0,2872.0,2589.0,3657.0,9159.0,2730.0,15940
"Cape Coral-Fort Myers, FL Metro Area",80878.0,1067.0,3718.0,4554.0,7747.0,7575.0,9260.0,5931.0,7915.0,27864.0,5247.0,15980
"Cape Girardeau, MO-IL Metro Area",12991.0,1261.0,864.0,1448.0,1652.0,1223.0,943.0,270.0,1046.0,2582.0,1702.0,16020
"Carson City, NV Metro Area",9020.0,315.0,458.0,624.0,1711.0,459.0,748.0,681.0,1165.0,2654.0,205.0,16180
"Casper, WY Metro Area",9172.0,109.0,942.0,775.0,1873.0,1733.0,738.0,629.0,303.0,1748.0,322.0,16220
"Cedar Rapids, IA Metro Area",30020.0,1279.0,3285.0,3230.0,3760.0,4004.0,3317.0,1146.0,2383.0,5782.0,1834.0,16300
"Centralia, WA Micro Area",8316.0,564.0,1048.0,653.0,1326.0,620.0,809.0,364.0,242.0,1796.0,894.0,16500
"Chambersburg, PA Metro Area",14857.0,454.0,3120.0,1694.0,1281.0,2694.0,1126.0,264.0,667.0,2681.0,876.0,16540
"Champaign-Urbana, IL Metro Area",43671.0,624.0,2225.0,4375.0,6014.0,2719.0,2617.0,2549.0,4980.0,11143.0,6425.0,16580
"Charleston, WV Metro Area",26263.0,1434.0,2957.0,2149.0,3495.0,2153.0,2884.0,1413.0,1216.0,5212.0,3350.0,16620
"Charleston-North Charleston, SC Metro Area",105724.0,2381.0,8261.0,9534.0,13989.0,14703.0,8025.0,5857.0,8085.0,26307.0,8582.0,16700
"Charlotte-Concord-Gastonia, NC-SC Metro Area",381928.0,12464.0,29244.0,48012.0,46123.0,39712.0,32706.0,27645.0,34137.0,90242.0,21643.0,16740
"Charlottesville, VA Metro Area",30918.0,835.0,2613.0,3805.0,2696.0,3211.0,2646.0,1855.0,3004.0,7952.0,2301.0,16820
"Chattanooga, TN-GA Metro Area",73782.0,2592.0,5715.0,9070.0,9596.0,7876.0,4844.0,3604.0,7704.0,16012.0,6769.0,16860
"Cheyenne, WY Metro Area",14254.0,794.0,1264.0,1463.0,1942.0,1598.0,1261.0,997.0,954.0,3103.0,878.0,16940
"Chicago-Naperville-Elgin, IL-IN Metro Area",1250819.0,49760.0,118081.0,155795.0,159846.0,130963.0,101501.0,73453.0,100580.0,285897.0,74943.0,16980
"Chico, CA Metro Area",37524.0,777.0,2528.0,2542.0,3265.0,4473.0,2661.0,2232.0,2643.0,13312.0,3091.0,17020
"Chillicothe, OH Micro Area",8921.0,438.0,693.0,1614.0,640.0,821.0,1451.0,528.0,630.0,1237.0,869.0,17060
"Cincinnati, OH-KY-IN Metro Area",300382.0,11514.0,25636.0,40815.0,37370.0,32958.0,27502.0,16473.0,22659.0,68764.0,16691.0,17140
"Clarksburg, WV Micro Area",9042.0,411.0,702.0,928.0,1247.0,539.0,900.0,412.0,842.0,1308.0,1753.0,17220
"Clarksville, TN-KY Metro Area",51900.0,1734.0,4108.0,6653.0,5952.0,6275.0,5646.0,2379.0,3461.0,10398.0,5294.0,17300
"Clearlake, CA Micro Area",6192.0,0.0,115.0,272.0,445.0,483.0,455.0,617.0,514.0,2055.0,1236.0,17340
"Cleveland, OH Metro Area",297590.0,11748.0,22467.0,37721.0,32419.0,33407.0,23372.0,16483.0,28208.0,69666.0,22099.0,17410
"Cleveland, TN Metro Area",15533.0,1088.0,1997.0,1277.0,1714.0,1430.0,1281.0,207.0,1689.0,3517.0,1333.0,17420
"Clovis, NM Micro Area",9132.0,248.0,360.0,1481.0,1491.0,1016.0,503.0,1119.0,644.0,1693.0,577.0,17580
"Coeur d'Alene, ID Metro Area",19787.0,378.0,1039.0,2105.0,2718.0,2621.0,1566.0,1294.0,2337.0,4388.0,1341.0,17660
"College Station-Bryan, TX Metro Area",53616.0,1775.0,3308.0,4127.0,5017.0,5448.0,3997.0,3204.0,3740.0,20511.0,2489.0,17780
"Colorado Springs, CO Metro Area",101967.0,1870.0,6450.0,10537.0,13475.0,12938.0,10137.0,6544.0,8575.0,27490.0,3951.0,17820
"Columbia, MO Metro Area",35957.0,1005.0,3497.0,4793.0,4808.0,3338.0,3042.0,1756.0,2828.0,8773.0,2117.0,17860
"Columbia, SC Metro Area",103371.0,2943.0,8932.0,8924.0,9731.0,11565.0,10302.0,6412.0,9582.0,27366.0,7614.0,17900
"Columbus, GA-AL Metro Area",54615.0,2053.0,2995.0,4966.0,7130.0,5363.0,5012.0,3095.0,4588.0,15241.0,4172.0,17980
"Columbus, IN Metro Area",10202.0,697.0,1632.0,1132.0,418.0,1001.0,1469.0,192.0,423.0,2701.0,537.0,18020
"Columbus, OH Metro Area",350473.0,11339.0,31532.0,44795.0,45115.0,39397.0,31758.0,22666.0,28171.0,76173.0,19527.0,18140
"Concord, NH Micro Area",17924.0,193.0,1480.0,2136.0,2886.0,2182.0,2020.0,1484.0,1717.0,2999.0,827.0,18180
"Cookeville, TN Micro Area",18982.0,707.0,893.0,2469.0,1625.0,1854.0,1190.0,1083.0,1242.0,5592.0,2327.0,18260
"Corbin, KY Micro Area",16908.0,1192.0,2112.0,894.0,1005.0,1571.0,1296.0,513.0,631.0,4010.0,3684.0,18340
"Corning, NY Micro Area",9668.0,963.0,997.0,963.0,587.0,1344.0,441.0,671.0,404.0,2590.0,708.0,18500
"Corpus Christi, TX Metro Area",64371.0,2142.0,6248.0,6024.0,7374.0,6959.0,5242.0,6061.0,6145.0,12566.0,5610.0,18580
"Corvallis, OR Metro Area",16276.0,549.0,502.0,1011.0,1847.0,1562.0,1780.0,345.0,1180.0,6493.0,1007.0,18700
"Crestview-Fort Walton Beach-Destin, FL Metro Area",33567.0,1289.0,1951.0,3430.0,2942.0,3483.0,2909.0,3113.0,3567.0,7400.0,3483.0,18880
"Cullman, AL Micro Area",7529.0,52.0,1037.0,844.0,739.0,645.0,644.0,598.0,622.0,1136.0,1212.0,18980
"Cumberland, MD-WV Micro Area",9470.0,882.0,843.0,741.0,823.0,1090.0,667.0,448.0,691.0,1999.0,1286.0,19060
"Dallas-Fort Worth-Arlington, TX Metro Area",1189772.0,27840.0,72189.0,129999.0,139382.0,146352.0,117497.0,88200.0,121114.0,295171.0,52028.0,19100
"Dalton, GA Metro Area",18878.0,439.0,2168.0,2624.0,2605.0,1562.0,1386.0,686.0,1453.0,3510.0,2445.0,19140
"Danville, IL Micro Area",10559.0,348.0,930.0,741.0,502.0,912.0,512.0,337.0,1477.0,2662.0,2138.0,19180
"Danville, VA Micro Area",13720.0,1126.0,1646.0,968.0,1259.0,1231.0,1101.0,428.0,1136.0,2877.0,1948.0,19260
"Daphne-Fairhope-Foley, AL Metro Area",26564.0,1133.0,2591.0,3004.0,4729.0,2509.0,2842.0,3254.0,1355.0,3933.0,1214.0,19300
"Davenport-Moline-Rock Island, IA-IL Metro Area",44100.0,2210.0,4692.0,5591.0,4893.0,3497.0,2818.0,3553.0,2415.0,9384.0,5047.0,19340
"Dayton-Kettering-Beavercreek, OH Metro Area",127612.0,4922.0,12538.0,16388.0,15682.0,14797.0,10945.0,8059.0,10388.0,28196.0,5697.0,19430
"Decatur, AL Metro Area",15940.0,1102.0,2148.0,2201.0,1803.0,1191.0,638.0,537.0,308.0,3701.0,2311.0,19460
"Decatur, IL Metro Area",13423.0,222.0,1053.0,1603.0,1968.0,1428.0,1147.0,570.0,1384.0,2984.0,1064.0,19500
"Deltona-Daytona Beach-Ormond Beach, FL Metro Area",74146.0,968.0,4005.0,5642.0,7669.0,8569.0,5574.0,4814.0,7284.0,22049.0,7572.0,19660
"Denver-Aurora-Centennial, CO Metro Area",459415.0,10071.0,28421.0,50565.0,57601.0,61218.0,42205.0,33048.0,44936.0,113846.0,17504.0,19740
"Des Moines-West Des Moines, IA Metro Area",92484.0,3953.0,7885.0,15350.0,14427.0,8877.0,8860.0,5067.0,5438.0,18603.0,4024.0,19780
"Detroit-Warren-Dearborn, MI Metro Area",494379.0,18544.0,37501.0,51746.0,56461.0,52906.0,44389.0,29309.0,39457.0,124771.0,39295.0,19820
"Dothan, AL Metro Area",20500.0,929.0,2105.0,2215.0,2282.0,1679.0,1464.0,1155.0,1503.0,4038.0,3130.0,20020
"Dover, DE Metro Area",20028.0,416.0,1438.0,3314.0,1050.0,2288.0,1876.0,1678.0,2008.0,4266.0,1694.0,20100
"DuBois, PA Micro Area",7265.0,635.0,1145.0,580.0,820.0,562.0,603.0,149.0,430.0,1484.0,857.0,20180
"Dubuque, IA Metro Area",11095.0,616.0,413.0,2581.0,1481.0,937.0,818.0,561.0,527.0,2348.0,813.0,20220
"Duluth, MN-WI Metro Area",33250.0,1736.0,2251.0,3249.0,4234.0,3493.0,2462.0,3037.0,3020.0,7756.0,2012.0,20260
"Durham-Chapel Hill, NC Metro Area",94459.0,2489.0,5360.0,10228.0,10514.0,10581.0,8378.0,6562.0,8575.0,24844.0,6928.0,20500
"Eagle Pass, TX Metro Area",6115.0,519.0,525.0,574.0,799.0,871.0,831.0,246.0,53.0,1263.0,434.0,20580
"East Stroudsburg, PA Micro Area",12749.0,351.0,814.0,1419.0,1218.0,1139.0,1449.0,1121.0,1239.0,3164.0,835.0,20700
"Eau Claire, WI Metro Area",22935.0,1536.0,3127.0,3025.0,3456.0,2504.0,1624.0,1128.0,1873.0,3834.0,828.0,20740
"El Centro, CA Metro Area",21913.0,936.0,1942.0,2483.0,3004.0,2104.0,1867.0,933.0,1901.0,4478.0,2265.0,20940
"Elizabethtown, KY Metro Area",17899.0,655.0,1524.0,1928.0,2593.0,2203.0,2224.0,801.0,754.0,4049.0,1168.0,21060
"Elkhart-Goshen, IN Metro Area",20914.0,430.0,935.0,3560.0,2208.0,2123.0,1680.0,1343.0,1397.0,5839.0,1399.0,21140
"Elmira, NY Metro Area",10582.0,421.0,441.0,944.0,1368.0,1013.0,851.0,819.0,657.0,3511.0,557.0,21300
"El Paso, TX Metro Area",110608.0,4007.0,6157.0,11677.0,13079.0,12039.0,10829.0,7507.0,10553.0,26172.0,8588.0,21340
"Enid, OK Metro Area",9167.0,466.0,1041.0,1967.0,970.0,598.0,750.0,422.0,476.0,1608.0,869.0,21420
"Erie, PA Metro Area",34445.0,1025.0,2554.0,5209.0,3991.0,3435.0,2859.0,2160.0,2499.0,8380.0,2333.0,21500
"Eugene-Springfield, OR Metro Area",65412.0,1486.0,3368.0,7019.0,7979.0,6706.0,4817.0,4851.0,5925.0,19922.0,3339.0,21660
"Eureka-Arcata, CA Micro Area",25457.0,344.0,1338.0,2342.0,1918.0,4121.0,1205.0,1967.0,2449.0,7090.0,2683.0,21700
"Evansville, IN Metro Area",34873.0,1921.0,2523.0,6081.0,3448.0,3537.0,3197.0,1669.0,2342.0,8006.0,2149.0,21780
"Fairbanks-College, AK Metro Area",13592.0,813.0,1193.0,1617.0,1775.0,1365.0,1197.0,461.0,1078.0,3453.0,640.0,21820
"Fargo, ND-MN Metro Area",50034.0,1799.0,6437.0,5106.0,5812.0,8187.0,4840.0,3013.0,3971.0,9372.0,1497.0,22020
"Faribault-Northfield, MN Micro Area",5740.0,59.0,913.0,592.0,615.0,334.0,846.0,266.0,721.0,1269.0,125.0,22060
"Farmington, MO Micro Area",7391.0,605.0,595.0,1056.0,508.0,1184.0,554.0,597.0,526.0,1591.0,175.0,22100
"Farmington, NM Metro Area",11685.0,1129.0,1375.0,1400.0,1004.0,843.0,1327.0,301.0,869.0,1802.0,1635.0,22140
"Fayetteville, NC Metro Area",62307.0,2169.0,4723.0,7334.0,8638.0,6219.0,4848.0,4332.0,5639.0,14154.0,4251.0,22180
"Fayetteville-Springdale-Rogers, AR Metro Area",87852.0,2335.0,12685.0,12260.0,8838.0,10449.0,8862.0,4834.0,6096.0,15365.0,6128.0,22220
"Findlay, OH Micro Area",9007.0,437.0,861.0,1196.0,1163.0,933.0,740.0,149.0,247.0,2712.0,569.0,22300
"Flagstaff, AZ Metro Area",22780.0,2027.0,1322.0,1198.0,2791.0,1776.0,1524.0,1858.0,2048.0,7311.0,925.0,22380
"Flint, MI Metro Area",45867.0,1207.0,3017.0,5018.0,5068.0,4480.0,2768.0,2840.0,5217.0,11640.0,4612.0,22420
"Florence, SC Metro Area",26160.0,1267.0,1595.0,1481.0,2518.0,2929.0,1270.0,1825.0,2847.0,6196.0,4232.0,22500
"Florence-Muscle Shoals, AL Metro Area",21971.0,1313.0,2486.0,2906.0,3764.0,2539.0,664.0,389.0,681.0,4362.0,2867.0,22520
"Fond du Lac, WI Metro Area",12977.0,561.0,1631.0,2457.0,1711.0,992.0,568.0,414.0,1891.0,2002.0,750.0,22540
"Forest City, NC Micro Area",7100.0,247.0,726.0,1016.0,1274.0,599.0,424.0,169.0,770.0,787.0,1088.0,22580
"Fort Collins-Loveland, CO Metro Area",57410.0,1279.0,3306.0,5688.0,6678.0,6867.0,4545.0,4903.0,6495.0,14271.0,3378.0,22660
"Fort Payne, AL Micro Area",4879.0,134.0,632.0,757.0,257.0,358.0,304.0,34.0,355.0,688.0,1360.0,22840
"Fort Smith, AR-OK Metro Area",30739.0,1867.0,4256.0,4457.0,3568.0,2140.0,2287.0,1971.0,1603.0,6022.0,2568.0,22900
"Fort Wayne, IN Metro Area",57065.0,2282.0,5655.0,7148.0,5708.0,4916.0,4962.0,3912.0,6436.0,12309.0,3737.0,23060
"Frankfort, KY Micro Area",9320.0,392.0,1220.0,1175.0,1007.0,462.0,692.0,204.0,1098.0,2213.0,857.0,23180
"Fresno, CA Metro Area",153425.0,4146.0,8057.0,14495.0,14896.0,15015.0,13730.0,9185.0,12767.0,49656.0,11478.0,23420
"Gadsden, AL Metro Area",10180.0,349.0,1153.0,421.0,1505.0,437.0,1071.0,585.0,1065.0,2381.0,1213.0,23460
"Gainesville, FL Metro Area",58679.0,1409.0,2854.0,4378.0,4874.0,4355.0,4771.0,4496.0,7950.0,19644.0,3948.0,23540
"Gainesville, GA Metro Area",24998.0,1615.0,2307.0,2313.0,2602.0,2075.0,2160.0,2596.0,1407.0,6200.0,1723.0,23580
"Gallup, NM Micro Area",7453.0,769.0,972.0,894.0,626.0,445.0,305.0,86.0,447.0,1404.0,1505.0,23700
"Gettysburg, PA Metro Area",9161.0,746.0,749.0,794.0,1044.0,1533.0,988.0,150.0,707.0,1603.0,847.0,23900
"Glens Falls, NY Metro Area",14948.0,519.0,864.0,2117.0,1938.0,1392.0,1695.0,628.0,648.0,3839.0,1308.0,24020
"Goldsboro, NC Metro Area",18893.0,1179.0,2050.0,1724.0,1541.0,2134.0,1327.0,1294.0,1732.0,2920.0,2992.0,24140
"Granbury, TX Micro Area",5013.0,96.0,614.0,318.0,995.0,527.0,275.0,170.0,497.0,1146.0,375.0,24180
"Grand Forks, ND-MN Metro Area",17604.0,498.0,1616.0,1255.0,3806.0,1937.0,1770.0,1073.0,840.0,4044.0,765.0,24220
"Grand Island, NE Metro Area",9919.0,91.0,1179.0,1467.0,1656.0,1014.0,901.0,415.0,1740.0,1066.0,390.0,24260
"Grand Junction, CO Metro Area",20820.0,399.0,1212.0,2423.0,2717.0,2487.0,2324.0,1635.0,2098.0,4574.0,951.0,24300
"Grand Rapids-Wyoming-Kentwood, MI Metro Area",112526.0,1961.0,10079.0,13583.0,15160.0,13086.0,8514.0,6732.0,12281.0,23950.0,7180.0,24340
"Grants Pass, OR Metro Area",9709.0,347.0,567.0,1447.0,941.0,476.0,1513.0,395.0,1818.0,1262.0,943.0,24420
"Great Falls, MT Metro Area",11598.0,957.0,968.0,1311.0,1670.0,1421.0,1745.0,638.0,237.0,2038.0,613.0,24500
"Greeley, CO Metro Area",32500.0,781.0,2339.0,2302.0,3516.0,2865.0,3097.0,2314.0,3884.0,9043.0,2359.0,24540
"Green Bay, WI Metro Area",43444.0,1885.0,4504.0,6720.0,7315.0,4424.0,3445.0,2704.0,2655.0,8145.0,1647.0,24580
"Greeneville, TN Micro Area",6458.0,534.0,921.0,500.0,877.0,467.0,184.0,484.0,26.0,1579.0,886.0,24620
"Greenfield, MA Micro Area",10300.0,521.0,371.0,1046.0,740.0,1097.0,498.0,884.0,726.0,3575.0,842.0,24640
"Greensboro-High Point, NC Metro Area",116544.0,4071.0,10330.0,10988.0,15470.0,11013.0,11259.0,8823.0,7355.0,27800.0,9435.0,24660
"Greenville, NC Metro Area",35005.0,1033.0,3934.0,3330.0,4198.0,2614.0,3531.0,1825.0,2800.0,9339.0,2401.0,24780
"Greenville-Anderson-Greer, SC Metro Area",116628.0,3500.0,10379.0,14107.0,12457.0,12590.0,10526.0,7384.0,10336.0,24858.0,10491.0,24860
"Greenwood, SC Micro Area",11942.0,791.0,630.0,1608.0,1884.0,1109.0,441.0,651.0,817.0,2331.0,1680.0,24940
"Guayama, PR Metro Area",6940.0,0.0,623.0,638.0,910.0,403.0,208.0,192.0,676.0,1548.0,1742.0,25020
"Gulfport-Biloxi, MS Metro Area",56202.0,2375.0,5426.0,5717.0,7981.0,6174.0,4809.0,2945.0,5153.0,11554.0,4068.0,25060
"Hagerstown-Martinsburg, MD-WV Metro Area",33694.0,1408.0,1782.0,3614.0,4013.0,4104.0,4315.0,2605.0,2460.0,6733.0,2660.0,25180
"Hammond, LA Metro Area",16571.0,608.0,913.0,1399.0,878.0,1686.0,1041.0,857.0,781.0,4846.0,3562.0,25220
"Hanford-Corcoran, CA Metro Area",19971.0,816.0,850.0,1662.0,3602.0,1336.0,2019.0,1252.0,1918.0,4434.0,2082.0,25260
"Harrisburg-Carlisle, PA Metro Area",78044.0,3878.0,7306.0,9196.0,10688.0,9305.0,5902.0,5827.0,5660.0,16184.0,4098.0,25420
"Harrisonburg, VA Metro Area",18126.0,1185.0,2106.0,3169.0,1478.0,1779.0,1051.0,750.0,1113.0,4139.0,1356.0,25500
"Hartford-West Hartford-East Hartford, CT Metro Area",155961.0,6061.0,12841.0,17768.0,18056.0,15899.0,12913.0,9392.0,12850.0,41153.0,9028.0,25540
"Hattiesburg, MS Metro Area",21319.0,426.0,1705.0,3682.0,1936.0,1342.0,2432.0,963.0,1703.0,4648.0,2482.0,25620
"Heber, UT Micro Area",5961.0,199.0,99.0,1579.0,1414.0,321.0,340.0,204.0,275.0,1224.0,306.0,25720
"Helena, MT Metro Area",10692.0,919.0,1115.0,1693.0,987.0,913.0,911.0,634.0,1035.0,1475.0,1010.0,25740
"Hermiston-Pendleton, OR Micro Area",12487.0,375.0,1242.0,2235.0,1090.0,1506.0,970.0,1181.0,657.0,2333.0,898.0,25840
"Hermitage, PA Micro Area",12727.0,814.0,1443.0,1075.0,2458.0,1078.0,1080.0,1017.0,356.0,1798.0,1608.0,25850
"Hickory-Lenoir-Morganton, NC Metro Area",41833.0,2179.0,5082.0,4588.0,6456.0,4080.0,3673.0,2267.0,2671.0,6126.0,4711.0,25860
"Hilo-Kailua, HI Micro Area",18831.0,105.0,1030.0,2014.0,1866.0,1920.0,1859.0,1068.0,1254.0,4678.0,3037.0,25900
"Hilton Head Island-Bluffton-Port Royal, SC Metro Area",24962.0,212.0,1079.0,1920.0,1891.0,4339.0,2576.0,1484.0,3662.0,5401.0,2398.0,25940
"Hinesville, GA Metro Area",13006.0,300.0,700.0,1325.0,1609.0,1570.0,1679.0,1708.0,1321.0,2016.0,778.0,25980
"Hobbs, NM Micro Area",7738.0,178.0,91.0,877.0,812.0,1165.0,857.0,755.0,648.0,872.0,1483.0,26020
"Holland, MI Micro Area",7147.0,267.0,449.0,697.0,825.0,1254.0,699.0,179.0,389.0,1518.0,870.0,26090
"Homosassa Springs, FL Metro Area",13277.0,358.0,792.0,922.0,789.0,2055.0,1006.0,1292.0,1005.0,3774.0,1284.0,26140
"Hot Springs, AR Metro Area",14924.0,229.0,1687.0,1736.0,2005.0,760.0,2005.0,885.0,1139.0,3459.0,1019.0,26300
"Houma-Bayou Cane-Thibodaux, LA Metro Area",18871.0,360.0,1754.0,2555.0,2338.0,2480.0,747.0,535.0,1375.0,4271.0,2456.0,26380
"Houston-Pasadena-The Woodlands, TX Metro Area",1054152.0,28830.0,67752.0,110452.0,138726.0,115793.0,91704.0,69589.0,100866.0,280381.0,50059.0,26420
"Huntington-Ashland, WV-KY-OH Metro Area",43106.0,2290.0,4779.0,4095.0,3967.0,2436.0,3794.0,2678.0,2265.0,10048.0,6754.0,26580
"Huntsville, AL Metro Area",62669.0,1830.0,7140.0,8690.0,8826.0,5576.0,4424.0,4851.0,4942.0,12621.0,3769.0,26620
"Huntsville, TX Micro Area",11003.0,0.0,377.0,2474.0,994.0,1080.0,1586.0,0.0,920.0,3027.0,545.0,26660
"Idaho Falls, ID Metro Area",15299.0,284.0,1890.0,2030.0,1160.0,1432.0,1424.0,1656.0,1148.0,2866.0,1409.0,26820
"Indiana, PA Micro Area",8705.0,675.0,515.0,325.0,1290.0,905.0,636.0,743.0,833.0,1954.0,829.0,26860
"Indianapolis-Carmel-Greenwood, IN Metro Area",282630.0,10686.0,24413.0,36600.0,37701.0,30253.0,23097.0,17663.0,21751.0,68567.0,11899.0,26900
"Iowa City, IA Metro Area",28784.0,804.0,2745.0,3204.0,2944.0,2551.0,2466.0,1224.0,2373.0,9241.0,1232.0,26980
"Ithaca, NY Metro Area",19317.0,368.0,982.0,2166.0,1220.0,1932.0,1318.0,2283.0,1785.0,6110.0,1153.0,27060
"Jackson, MI Metro Area",14365.0,511.0,864.0,1776.0,1948.0,1080.0,814.0,764.0,1109.0,4380.0,1119.0,27100
"Jackson, MS Metro Area",77161.0,1346.0,5864.0,6897.0,8307.0,9639.0,6012.0,5276.0,6788.0,19158.0,7874.0,27140
"Jackson, TN Metro Area",26321.0,1034.0,3358.0,2641.0,2858.0,2194.0,1506.0,645.0,2211.0,6219.0,3655.0,27180
"Jacksonville, FL Metro Area",230875.0,8500.0,12244.0,23762.0,21746.0,22585.0,23886.0,16907.0,20195.0,64995.0,16055.0,27260
"Jacksonville, NC Metro Area",29277.0,1408.0,1215.0,3620.0,3995.0,3506.0,2910.0,2230.0,3580.0,5357.0,1456.0,27340
"Jamestown-Dunkirk, NY Micro Area",16254.0,562.0,1957.0,2202.0,1356.0,1633.0,1493.0,1013.0,1043.0,3792.0,1203.0,27460
"Janesville-Beloit, WI Metro Area",19513.0,639.0,1570.0,2230.0,2746.0,1987.0,1982.0,502.0,2199.0,4238.0,1420.0,27500
"Jefferson, GA Micro Area",7459.0,682.0,535.0,1620.0,715.0,540.0,508.0,174.0,763.0,1208.0,714.0,27600
