"Valdosta, GA Metro Area",25015.0,875.0,2439.0,1431.0,2390.0,2545.0,2104.0,913.0,2357.0,4149.0,5812.0,46660
"Vallejo-Fairfield, CA Metro Area",56434.0,1153.0,4032.0,7155.0,6766.0,7188.0,5779.0,4916.0,3944.0,12691.0,2810.0,46700
"Urban Honolulu, HI Metro Area",137431.0,4264.0,8300.0,14702.0,15012.0,15067.0,13287.0,8438.0,14457.0,34006.0,9898.0,46520
"Utica-Rome, NY Metro Area",36881.0,1763.0,5021.0,5427.0,3178.0,2874.0,2806.0,1604.0,3031.0,7563.0,3614.0,46540
"Washington-Arlington-Alexandria, DC-VA-MD-WV Metro Area",814784.0,27093.0,64885.0,108557.0,117377.0,92978.0,72668.0,55643.0,62508.0,181156.0,31919.0,47900
"Waterloo-Cedar Falls, IA Metro Area",20933.0,627.0,1943.0,3197.0,1825.0,2224.0,1629.0,1201.0,1462.0,5619.0,1206.0,47940
"Victoria, TX Metro Area",10947.0,398.0,345.0,1275.0,965.0,895.0,519.0,899.0,485.0,3879.0,1287.0,47020
"Vineland-Bridgeton, NJ Metro Area",16264.0,227.0,521.0,1215.0,771.0,1851.0,1804.0,1129.0,1387.0,6579.0,780.0,47220
"Virginia Beach-Norfolk-Newport News, VA-NC Metro Area",257608.0,6367.0,17109.0,30433.0,31817.0,31149.0,24711.0,19115.0,25840.0,55991.0,15076.0,47260
"Visalia-Porterville, CA Metro Area",57335.0,2137.0,6462.0,5461.0,5105.0,4032.0,5223.0,3772.0,5643.0,15944.0,3556.0,47300
"Kalamazoo-Portage, MI Metro Area",43257.0,2169.0,3354.0,5220.0,6408.0,4480.0,4582.0,1716.0,4404.0,8605.0,2319.0,28020
"Kalispell, MT Micro Area",10709.0,551.0,773.0,1448.0,794.0,1239.0,727.0,562.0,713.0,2726.0,1176.0,28060
"Kankakee, IL Metro Area",13353.0,264.0,890.0,1142.0,1680.0,1213.0,1297.0,1013.0,1576.0,3358.0,920.0,28100
"Kansas City, MO-KS Metro Area",292182.0,11928.0,29286.0,40291.0,39731.0,31271.0,23271.0,19058.0,23592.0,57664.0,16090.0,28140
"Kapaa, HI Micro Area",9247.0,572.0,1150.0,807.0,1111.0,979.0,621.0,389.0,719.0,1815.0,1084.0,28180
"Keene, NH Micro Area",9345.0,611.0,878.0,867.0,1227.0,1261.0,456.0,1070.0,783.0,1981.0,211.0,28300
"Kennewick-Richland, WA Metro Area",32496.0,663.0,2948.0,5062.0,4819.0,3294.0,3365.0,2635.0,2703.0,4823.0,2184.0,28420
"Key West, FL Micro Area",11279.0,247.0,579.0,841.0,780.0,1358.0,1238.0,1020.0,1371.0,3031.0,814.0,28580
"Killeen-Temple, TX Metro Area",66702.0,2462.0,6477.0,8394.0,10768.0,7552.0,5004.0,5135.0,4994.0,12018.0,3898.0,28660
"Kingsport-Bristol-Bristol, TN-VA Metro Area",33470.0,1481.0,3781.0,3934.0,3365.0,3448.0,2603.0,2359.0,1649.0,5975.0,4875.0,28700
"Kingston, NY Metro Area",22663.0,788.0,1507.0,1966.0,2125.0,2928.0,2506.0,1760.0,1021.0,6044.0,2018.0,28740
"Klamath Falls, OR Micro Area",9732.0,373.0,1589.0,1466.0,650.0,507.0,1278.0,132.0,333.0,2853.0,551.0,28900
"Knoxville, TN Metro Area",107919.0,4487.0,9309.0,14987.0,10694.0,11977.0,9729.0,7110.0,8053.0,21574.0,9999.0,28940
"Kokomo, IN Metro Area",11267.0,1569.0,1147.0,1556.0,1623.0,741.0,616.0,430.0,367.0,2842.0,376.0,29020
"La Crosse-Onalaska, WI-MN Metro Area",20281.0,652.0,2105.0,2998.0,3283.0,1965.0,1651.0,988.0,1289.0,4165.0,1185.0,29100
"Lafayette, LA Metro Area",57686.0,3141.0,6990.0,4638.0,5842.0,4538.0,4597.0,1871.0,4659.0,13000.0,8410.0,29180
"Lafayette-West Lafayette, IN Metro Area",35477.0,579.0,3407.0,4022.0,3476.0,3510.0,3863.0,1812.0,2716.0,9396.0,2696.0,29200
"LaGrange, GA Micro Area",10800.0,383.0,1136.0,589.0,1162.0,689.0,982.0,260.0,1047.0,3357.0,1195.0,29300
"Lake Charles, LA Metro Area",26862.0,1403.0,3871.0,3308.0,2943.0,2079.0,1891.0,1648.0,2708.0,4161.0,2850.0,29340
"Lake City, FL Micro Area",6613.0,516.0,741.0,597.0,1064.0,673.0,456.0,335.0,773.0,948.0,510.0,29380
"Lake Havasu City-Kingman, AZ Metro Area",26616.0,1376.0,2355.0,3447.0,2937.0,3085.0,1524.0,1785.0,1777.0,4669.0,3661.0,29420
"Lakeland-Winter Haven, FL Metro Area",73224.0,1950.0,5446.0,10318.0,9327.0,9291.0,6767.0,4788.0,5687.0,13912.0,5738.0,29460
"Lancaster, PA Metro Area",66038.0,1787.0,7090.0,9052.0,8641.0,5909.0,5521.0,5425.0,5426.0,13470.0,3717.0,29540
"Lansing-East Lansing, MI Metro Area",65471.0,2662.0,5453.0,8359.0,6695.0,7051.0,4267.0,3290.0,5753.0,17756.0,4185.0,29620
"Laredo, TX Metro Area",29464.0,814.0,2145.0,3779.0,3016.0,3737.0,1869.0,1871.0,2368.0,7008.0,2857.0,29700
"Las Cruces, NM Metro Area",31765.0,598.0,2996.0,2513.0,3437.0,3483.0,2769.0,2355.0,3357.0,7628.0,2629.0,29740
"Las Vegas-Henderson-Paradise, NV Metro Area",370321.0,9934.0,26205.0,42372.0,48334.0,37062.0,34269.0,24746.0,36177.0,91012.0,20210.0,29820
"Laurel, MS Micro Area",7200.0,702.0,786.0,526.0,1154.0,284.0,260.0,233.0,638.0,1081.0,1536.0,29860
"Lawrence, KS Metro Area",23008.0,839.0,1383.0,2818.0,3934.0,1927.0,1545.0,1300.0,1438.0,6871.0,953.0,29940
"Lawton, OK Metro Area",19420.0,710.0,2817.0,3129.0,2781.0,1453.0,977.0,914.0,2094.0,3105.0,1440.0,30020
"Lebanon, PA Metro Area",16007.0,565.0,1804.0,2876.0,1791.0,1423.0,1372.0,506.0,1420.0,3559.0,691.0,30140
"Lewiston, ID-WA Metro Area",6855.0,707.0,567.0,556.0,677.0,664.0,437.0,518.0,496.0,1782.0,451.0,30300
"Lewiston-Auburn, ME Metro Area",17309.0,565.0,1548.0,1865.0,2221.0,3265.0,1160.0,1110.0,1490.0,3391.0,694.0,30340
"Lexington-Fayette, KY Metro Area",81546.0,3108.0,6438.0,11441.0,11308.0,9446.0,8646.0,3574.0,5515.0,17184.0,4886.0,30460
"Lima, OH Metro Area",14401.0,1165.0,1200.0,1791.0,1863.0,1883.0,1570.0,1010.0,468.0,2790.0,661.0,30620
"Lincoln, NE Metro Area",52352.0,2050.0,5118.0,9295.0,7792.0,6188.0,2778.0,3207.0,2591.0,11375.0,1958.0,30700
"Little Rock-North Little Rock-Conway, AR Metro Area",99308.0,4322.0,7996.0,13341.0,9771.0,10840.0,9040.0,7970.0,6512.0,23116.0,6400.0,30780
"Logan, UT-ID Metro Area",15277.0,688.0,1395.0,2269.0,1732.0,1432.0,1035.0,1182.0,1649.0,3279.0,616.0,30860
"London, KY Micro Area",15518.0,1244.0,1166.0,1126.0,1825.0,1116.0,1437.0,1189.0,502.0,2382.0,3531.0,30940
"Longview, TX Metro Area",25308.0,1316.0,1883.0,3186.0,3501.0,1999.0,1185.0,2217.0,2187.0,5140.0,2694.0,30980
"Longview, WA Metro Area",13875.0,449.0,1110.0,2225.0,1563.0,1154.0,1682.0,775.0,1470.0,2549.0,898.0,31020
"Los Angeles-Long Beach-Anaheim, CA Metro Area",2255530.0,59531.0,142037.0,222539.0,255072.0,247474.0,199589.0,157492.0,226603.0,637960.0,107233.0,31080
"Louisville/Jefferson County, KY-IN Metro Area",168200.0,7611.0,17332.0,23003.0,18402.0,17653.0,11800.0,11682.0,12765.0,36216.0,11736.0,31140
"Lubbock, TX Metro Area",52004.0,1606.0,3418.0,4548.0,4580.0,5350.0,4483.0,2469.0,5328.0,16236.0,3986.0,31180
"Lufkin, TX Micro Area",10461.0,691.0,2003.0,469.0,883.0,446.0,1093.0,997.0,712.0,2362.0,805.0,31260
"Lumberton, NC Micro Area",16336.0,885.0,1284.0,1749.0,1386.0,1562.0,1053.0,1044.0,1212.0,2817.0,3344.0,31300
"Lynchburg, VA Metro Area",31675.0,1509.0,3602.0,2406.0,3866.0,2629.0,2681.0,2535.0,3778.0,5479.0,3190.0,31340
"Macon-Bibb County, GA Metro Area",34631.0,935.0,2832.0,4636.0,3624.0,2413.0,2885.0,1461.0,3299.0,8980.0,3566.0,31420
"Madera, CA Metro Area",16065.0,231.0,1153.0,1860.0,1767.0,3170.0,1390.0,498.0,1271.0,3297.0,1428.0,31460
"Madison, WI Metro Area",107519.0,3351.0,9892.0,15143.0,15869.0,13099.0,10138.0,4922.0,9316.0,21819.0,3970.0,31540
"Manchester-Nashua, NH Metro Area",54743.0,2560.0,4207.0,7096.0,7952.0,5572.0,5770.0,3377.0,4105.0,12600.0,1504.0,31700
"Manhattan, KS Metro Area",17837.0,308.0,869.0,2471.0,1864.0,1615.0,1804.0,1209.0,1356.0,5554.0,787.0,31740
"Manitowoc, WI Micro Area",9029.0,593.0,1529.0,1420.0,1201.0,1020.0,425.0,729.0,500.0,876.0,736.0,31820
"Mankato-North Mankato, MN Metro Area",13007.0,315.0,1240.0,1525.0,2221.0,988.0,899.0,436.0,957.0,3661.0,765.0,31860
"Mansfield, OH Metro Area",16045.0,749.0,2959.0,1100.0,1430.0,2063.0,607.0,685.0,1748.0,3445.0,1259.0,31900
"Marinette, WI-MI Micro Area",6249.0,352.0,735.0,803.0,600.0,696.0,519.0,157.0,380.0,1151.0,856.0,31940
"Marion, IN Micro Area",6976.0,777.0,150.0,807.0,448.0,1320.0,456.0,550.0,231.0,1363.0,874.0,31980
